{
  "build": {
    "build_type": "RelWithDebInfo",
    "compiler": "/usr/bin/c++",
    "rmw_implementation": "rmw_fastrtps_cpp",
    "ros_distro": "humble"
  },
  "capture_backend": "rosbag2",
  "capture_quality": null,
  "comparison": {
    "approximated_count": 2,
    "backend": "rosbag2",
    "comparable_scope": "serialized_workload_topics_only",
    "content_equivalence_note": "The configured benchmark topics carry the same full serialized payloads. Native control chronology is excluded from workload counts and storage equivalence.",
    "content_equivalent_to_native": true,
    "counter_reconciled": false,
    "dimensions": {
      "aggregate_rate_hz": {
        "backend": 5000.0,
        "native": 5000.0,
        "note": null,
        "status": "matched"
      },
      "compression": {
        "backend": "none",
        "native": "none",
        "note": null,
        "status": "matched"
      },
      "control_chronology": {
        "backend": "workload topics only",
        "native": "graph, trigger, clock, status, and drop events share the chronology",
        "note": null,
        "status": "unmatched"
      },
      "discovery_warmup_sec": {
        "backend": 2.0,
        "native": 2.0,
        "note": null,
        "status": "matched"
      },
      "durability_sync_policy": {
        "backend": "rosbag2 MCAP close/finalization; no equivalent fsync contract was observed",
        "native": "periodic flush plus fsync on segment close and directory update",
        "note": null,
        "status": "unmatched"
      },
      "duration_sec": {
        "backend": 30.0,
        "native": 30.0,
        "note": null,
        "status": "matched"
      },
      "ingest_timestamp_clock": {
        "backend": "realtime receive timestamp corrected with sampled realtime-minus-monotonic offset",
        "native": "CLOCK_MONOTONIC callback timestamp",
        "note": "latency is suppressed if clock-offset drift exceeds the configured limit",
        "status": "approximated"
      },
      "loss_accounting": {
        "backend": "no authoritative callback-received or drop ledger in the stock recorder",
        "native": "callback-level received and reasoned drop counters",
        "note": null,
        "status": "unmatched"
      },
      "message_deserialization": {
        "backend": "none (generic serialized)",
        "native": "none (generic serialized)",
        "note": null,
        "status": "matched"
      },
      "message_type": {
        "backend": "std_msgs/msg/ByteMultiArray",
        "native": "std_msgs/msg/ByteMultiArray",
        "note": null,
        "status": "matched"
      },
      "payload_bytes": {
        "backend": 256,
        "native": 256,
        "note": null,
        "status": "matched"
      },
      "process_accounting_boundary": {
        "backend": "rosbag2 recorder process selected below the ros2 CLI wrapper when present",
        "native": "native recorder process",
        "note": null,
        "status": "matched"
      },
      "publisher": {
        "backend": "blackbox_capture_bench publisher",
        "native": "blackbox_capture_bench publisher",
        "note": "the same publisher binary is launched with the same arguments for every backend",
        "status": "matched"
      },
      "publisher_qos": {
        "backend": "best_effort/depth 10",
        "native": "best_effort/depth 10",
        "note": null,
        "status": "matched"
      },
      "segment_split_bytes": {
        "backend": 67108864,
        "native": 67108864,
        "note": null,
        "status": "matched"
      },
      "segment_split_duration_sec": {
        "backend": 5.0,
        "native": 5.0,
        "note": null,
        "status": "matched"
      },
      "shutdown_signal": {
        "backend": "SIGINT to the process group",
        "native": "SIGINT to the process group",
        "note": null,
        "status": "matched"
      },
      "storage_chunk_size_bytes": {
        "backend": 1048576,
        "native": 1048576,
        "note": null,
        "status": "matched"
      },
      "storage_chunking": {
        "backend": "enabled, chunk CRC on",
        "native": "enabled, chunk CRC on",
        "note": null,
        "status": "matched"
      },
      "storage_plugin": {
        "backend": "mcap",
        "native": "mcap",
        "note": null,
        "status": "matched"
      },
      "subscription_durability": {
        "backend": "volatile",
        "native": "volatile",
        "note": null,
        "status": "matched"
      },
      "subscription_history_depth": {
        "backend": 1000,
        "native": 1000,
        "note": null,
        "status": "matched"
      },
      "subscription_reliability": {
        "backend": "best_effort",
        "native": "best_effort",
        "note": null,
        "status": "matched"
      },
      "topic_discovery_period_ms": {
        "backend": 100,
        "native": 100,
        "note": null,
        "status": "matched"
      },
      "topics": {
        "backend": 10,
        "native": 10,
        "note": null,
        "status": "matched"
      },
      "write_buffering": {
        "backend": "16777216 cache bytes with rosbag2 double buffering",
        "native": "4096-event ring plus 16777216 payload-arena bytes",
        "note": "the byte cache and native event-plus-payload bounds are not equivalent",
        "status": "approximated"
      }
    },
    "matched_count": 21,
    "not_applicable_count": 0,
    "reconciliation_note": "A clean rosbag2 file provides a retained-record count, but stock rosbag2 does not expose callback-received or reasoned-drop counters. Missing records remain unexplained.",
    "reference_backend": "native",
    "unmatched_count": 3
  },
  "counters": {
    "admitted": null,
    "committed": null,
    "dropped": null,
    "dropped_bytes": null,
    "durable": null,
    "durable_observed_lower_bound": null,
    "negative_ingest_latencies": 0,
    "publish_calls": 149999,
    "received": null,
    "sent": 149999,
    "serialized_committed": 149999,
    "serialized_committed_bytes": 40799728,
    "serialized_dropped": null,
    "serialized_retained": 149999,
    "serialized_retained_bytes": 40799728
  },
  "drop_breakdown": null,
  "generated_at": "2026-08-11T18:59:25.498820Z",
  "git_dirty": false,
  "git_sha": "ec3a6e7991d7674948fadc0d3200f74acd87feb0",
  "latency_us": {
    "ingest": {
      "negative_count": 0,
      "p50": 10.373,
      "p95": 14.347,
      "p99": 22.343099999999946,
      "population": 149999,
      "reason": "publisher steady timestamp to rosbag2 realtime receive timestamp, corrected using the sampled realtime-minus-monotonic offset",
      "sample_cap": 100000,
      "sample_size": 100000,
      "valid": true
    },
    "trigger_to_flush": {
      "p50": null,
      "p95": null,
      "p99": null,
      "reason": "this workload does not issue and durably acknowledge a trigger",
      "supported": false
    },
    "write": {
      "p50": null,
      "p95": null,
      "p99": null,
      "reason": "the selected recorder does not expose write-service samples",
      "supported": false
    }
  },
  "lifecycle": {
    "capture_closed_cleanly": true,
    "capture_exit_code": 0,
    "final_status_state": null,
    "forced_shutdown": false,
    "publisher_exit_code": 0,
    "shutdown_drain_ms": 163.55208900131402,
    "startup_latency_ms": 152.93915500114963,
    "status_source": null
  },
  "machine": {
    "architecture": "x86_64",
    "gpu_recorded": false,
    "hostname_recorded": false,
    "logical_cpu_count": 24,
    "os": "Linux",
    "os_release": "6.8.0-136-generic"
  },
  "measurement_limitations": [
    "Stock rosbag2 exposes retained records but no authoritative callback-received or reasoned-drop counters.",
    "The rosbag2 cache and native bounded event-ring plus payload arena are only an approximate buffering match.",
    "rosbag2 ingest latency uses a sampled realtime-minus-monotonic clock correction.",
    "Startup latency ends at the backend log liveness marker; complete subscription matching is checked separately before measurement.",
    "CPU and RSS cover the recorder process only; publisher resource use is not sampled.",
    "Write-service latency, durable flush latency, and trigger latency are unsupported."
  ],
  "provenance": {
    "capture_command": [
      "ros2",
      "bag",
      "record",
      "--storage",
      "mcap",
      "--output",
      "/tmp/blackboxrs-rosbag2-bench-sprj4n9q/capture",
      "--polling-interval",
      "100",
      "--max-bag-size",
      "67108864",
      "--max-bag-duration",
      "5",
      "--max-cache-size",
      "16777216",
      "--qos-profile-overrides-path",
      "/tmp/blackboxrs-rosbag2-bench-sprj4n9q/rosbag2_qos.yaml",
      "--storage-config-file",
      "/tmp/blackboxrs-rosbag2-bench-sprj4n9q/rosbag2_mcap.yaml",
      "/blackbox_bench/topic0",
      "/blackbox_bench/topic1",
      "/blackbox_bench/topic2",
      "/blackbox_bench/topic3",
      "/blackbox_bench/topic4",
      "/blackbox_bench/topic5",
      "/blackbox_bench/topic6",
      "/blackbox_bench/topic7",
      "/blackbox_bench/topic8",
      "/blackbox_bench/topic9"
    ],
    "clock_offset": {
      "drift_limit_ns": 2000000,
      "drift_ns": 4530,
      "max_offset_ns": 1786465892244501223,
      "min_offset_ns": 1786465892244496693,
      "sample_count": 123
    },
    "failure_injection": {
      "expect_storage_fault": false,
      "fail_after_bytes": -1,
      "writer_delay_ms": 0
    },
    "generated_recorder_params": false,
    "generated_rosbag2_qos": true,
    "generated_rosbag2_storage_config": true,
    "latency_clock_domain": "local_realtime_corrected_to_steady",
    "publisher_command": [
      "install/matrix_5x_ec3a6e7/blackbox_capture_bench/lib/blackbox_capture_bench/publisher",
      "--topics",
      "10",
      "--aggregate-rate",
      "5000.0",
      "--payload-bytes",
      "256",
      "--duration-sec",
      "30.0",